{
  "meta": {
    "platform": "douyin",
    "fps": 30,
    "width": 1080,
    "height": 1920,
    "safe_area": {
      "top": 200,
      "bottom": 400,
      "left": 60,
      "right": 200
    },
    "target_seconds": 38.0,
    "anchor_type": "efficiency",
    "anchor_zh": "效率反差",
    "viewpoint": "你花时间做的事，本来就不该你来做",
    "note": "38 秒骨架模板。改 voiceover_text 即可用，帧号不用动；改字数后重跑 validate.py。"
  },
  "scenes": [
    {
      "scene_id": "s1",
      "narrative_beat": "hook",
      "startFrame": 0,
      "durationInFrames": 72,
      "type": "statement",
      "voiceover_text": "改一份格式，你花了四十分钟。",
      "subtitle_lines": [
        "改一份格式",
        "你花了四十分钟"
      ],
      "emphasis_words": [
        "四十分钟"
      ],
      "emotion": {
        "level": 5,
        "direction": "flat"
      },
      "motion_budget": 3,
      "first_frame_visible": true,
      "typewriter": true,
      "animation": {
        "enter": "scale-up",
        "spring": "bouncy",
        "enterFrames": 14
      },
      "visual": {
        "asset": "result_first_frame",
        "highlight_region": "center"
      }
    },
    {
      "scene_id": "s2",
      "narrative_beat": "conflict",
      "startFrame": 64,
      "durationInFrames": 240,
      "type": "statement",
      "voiceover_text": "这不是手慢。是你把判断做完之后，还得替机器干一遍搬运的活，七步，一步都不能少。",
      "subtitle_lines": [
        "这不是手慢",
        "是你替机器搬运"
      ],
      "emphasis_words": [
        "不是手慢",
        "一步都不能少"
      ],
      "emotion": {
        "level": 4,
        "direction": "down"
      },
      "motion_budget": 1,
      "first_frame_visible": false,
      "typewriter": false,
      "animation": {
        "enter": "fade-up",
        "spring": "smooth",
        "enterFrames": 12
      },
      "visual": {
        "asset": "pain_split",
        "highlight_region": "left_side"
      }
    },
    {
      "scene_id": "s3",
      "narrative_beat": "progressive_breakdown",
      "startFrame": 296,
      "durationInFrames": 258,
      "type": "bullets",
      "voiceover_text": "你以为是快，但问题是，快只是表面。更狠的是，它把改格式那一步整个拿掉了。",
      "subtitle_lines": [
        "快只是表面",
        "那一步整个拿掉了"
      ],
      "emphasis_words": [
        "但问题是",
        "更狠的是",
        "整个拿掉了"
      ],
      "emotion": {
        "level": 3,
        "direction": "up"
      },
      "motion_budget": 2,
      "first_frame_visible": false,
      "typewriter": false,
      "animation": {
        "enter": "slide-from-bottom",
        "spring": "snappy",
        "enterFrames": 12
      },
      "visual": {
        "asset": "before_after_split",
        "highlight_region": "after_side"
      }
    },
    {
      "scene_id": "s4",
      "narrative_beat": "midpoint_hook",
      "startFrame": 546,
      "durationInFrames": 42,
      "type": "title",
      "voiceover_text": "真正离谱的是下一个。",
      "subtitle_lines": [
        "真正离谱的是下一个"
      ],
      "emphasis_words": [
        "真正离谱"
      ],
      "emotion": {
        "level": 4,
        "direction": "up"
      },
      "motion_budget": 1,
      "first_frame_visible": false,
      "typewriter": false,
      "animation": {
        "enter": "scale-up",
        "spring": "snappy",
        "enterFrames": 10
      },
      "visual": {
        "asset": "solid_black",
        "highlight_region": "center"
      }
    },
    {
      "scene_id": "s5",
      "narrative_beat": "progressive_breakdown",
      "startFrame": 580,
      "durationInFrames": 228,
      "type": "bullets",
      "voiceover_text": "关键是第二步。它不只改格式，连命名和归档一起做了，你只需要点头。",
      "subtitle_lines": [
        "关键是第二步",
        "连归档一起做了"
      ],
      "emphasis_words": [
        "关键是第二步",
        "点头"
      ],
      "emotion": {
        "level": 5,
        "direction": "up"
      },
      "motion_budget": 2,
      "first_frame_visible": false,
      "typewriter": false,
      "animation": {
        "enter": "slide-from-bottom",
        "spring": "smooth",
        "enterFrames": 12
      },
      "visual": {
        "asset": "pipeline_steps",
        "highlight_region": "middle_steps"
      }
    },
    {
      "scene_id": "s6",
      "narrative_beat": "viewpoint",
      "startFrame": 800,
      "durationInFrames": 180,
      "type": "quote",
      "voiceover_text": "所以你花时间做的事，本来就不该你来做。这条，你以后会用得上。",
      "subtitle_lines": [
        "你花时间做的事",
        "本来就不该你来做"
      ],
      "emphasis_words": [
        "不该你来做",
        "用得上"
      ],
      "emotion": {
        "level": 5,
        "direction": "flat"
      },
      "motion_budget": 1,
      "first_frame_visible": false,
      "typewriter": false,
      "animation": {
        "enter": "scale-up",
        "spring": "bouncy",
        "enterFrames": 16
      },
      "visual": {
        "asset": "solid_black",
        "highlight_region": "center"
      }
    },
    {
      "scene_id": "s7",
      "narrative_beat": "cta",
      "startFrame": 972,
      "durationInFrames": 120,
      "type": "title",
      "voiceover_text": "完整用法在主页粉丝群，拿走去用。",
      "subtitle_lines": [
        "完整用法在主页粉丝群"
      ],
      "emphasis_words": [
        "主页粉丝群"
      ],
      "emotion": {
        "level": 3,
        "direction": "flat"
      },
      "motion_budget": 1,
      "first_frame_visible": false,
      "typewriter": false,
      "animation": {
        "enter": "fade-up",
        "spring": "smooth",
        "enterFrames": 12
      },
      "visual": {
        "asset": "group_entry",
        "highlight_region": "bottom"
      }
    }
  ],
  "transitions": [
    {
      "after_scene": "s1",
      "durationInFrames": 8,
      "kind": "fade"
    },
    {
      "after_scene": "s2",
      "durationInFrames": 8,
      "kind": "fade"
    },
    {
      "after_scene": "s3",
      "durationInFrames": 8,
      "kind": "fade"
    },
    {
      "after_scene": "s4",
      "durationInFrames": 8,
      "kind": "fade"
    },
    {
      "after_scene": "s5",
      "durationInFrames": 8,
      "kind": "fade"
    },
    {
      "after_scene": "s6",
      "durationInFrames": 8,
      "kind": "fade"
    }
  ],
  "totalCompositionFrames": 1092
}
